{
  "$schema": "../../schemas/tool-schema.json",
  "name": "message-list",
  "title": "List Thread Messages",
  "description": "Retrieve all messages from a conversation thread with pagination support. Use this to view conversation history, analyze message patterns, or get context for assistant responses. Essential for understanding conversation flow and debugging assistant behavior.",
  "category": "message",
  "hints": {
    "readOnly": true
  },
  "inputSchema": {
    "type": "object",
    "properties": {
      "thread_id": {
        "type": "string",
        "description": "The unique identifier of the thread to list messages from (format: \"thread_abc123...\")."
      },
      "limit": {
        "type": "number",
        "description": "Maximum number of messages to return in one request (1-100, default: 20). Use smaller values for quick previews, larger for comprehensive history."
      },
      "order": {
        "type": "string",
        "enum": ["asc", "desc"],
        "description": "Sort order by creation date: \"desc\" for newest first (default), \"asc\" for oldest first (chronological order)."
      },
      "after": {
        "type": "string",
        "description": "Pagination cursor - message ID to start listing after (format: \"msg_abc123...\"). Use for getting the next page of results."
      },
      "before": {
        "type": "string",
        "description": "Pagination cursor - message ID to end listing before (format: \"msg_abc123...\"). Use for getting the previous page of results."
      },
      "run_id": {
        "type": "string",
        "description": "Filter messages by specific run ID (format: \"run_abc123...\"). Shows only messages from that particular assistant run."
      }
    },
    "required": ["thread_id"]
  },
  "examples": [
    {
      "title": "Get recent messages",
      "description": "Retrieve the latest messages from a conversation thread",
      "input": {
        "thread_id": "thread_abc123def456ghi789jkl012",
        "limit": 10,
        "order": "desc"
      }
    },
    {
      "title": "Get chronological conversation",
      "description": "View the complete conversation in chronological order",
      "input": {
        "thread_id": "thread_abc123def456ghi789jkl012",
        "order": "asc"
      }
    }
  ],
  "metadata": {
    "version": "1.0.0",
    "author": "OpenAI Assistants MCP Team",
    "lastModified": "2025-01-31T02:37:00.000Z",
    "tags": ["message", "list", "conversation", "history"]
  }
}