{
  "$schema": "../../schemas/tool-schema.json",
  "name": "message-update",
  "title": "Update Message",
  "description": "Modify an existing message's metadata. Use this to add tags, update tracking information, or organize messages better. Note that message content cannot be changed, only metadata can be updated.",
  "category": "message",
  "inputSchema": {
    "type": "object",
    "properties": {
      "thread_id": {
        "type": "string",
        "description": "The unique identifier of the thread containing the message (format: \"thread_abc123...\")."
      },
      "message_id": {
        "type": "string",
        "description": "The unique identifier of the message to update (format: \"msg_abc123...\")."
      },
      "metadata": {
        "type": "object",
        "description": "New metadata key-value pairs to replace existing metadata (e.g., {\"importance\": \"high\", \"category\": \"question\"})."
      }
    },
    "required": ["thread_id", "message_id"]
  },
  "examples": [
    {
      "title": "Tag important message",
      "description": "Add metadata to mark a message as important",
      "input": {
        "thread_id": "thread_abc123def456ghi789jkl012",
        "message_id": "msg_abc123def456ghi789jkl012",
        "metadata": {
          "importance": "high",
          "category": "question",
          "requires_followup": "true"
        }
      }
    }
  ],
  "metadata": {
    "version": "1.0.0",
    "author": "OpenAI Assistants MCP Team",
    "lastModified": "2025-01-31T02:38:00.000Z",
    "tags": ["message", "update", "metadata", "organization"]
  }
}