{
  "$schema": "../../schemas/tool-schema.json",
  "name": "assistant-create",
  "title": "Create AI Assistant",
  "description": "Create a new AI assistant with custom instructions and capabilities for a specific task or domain. Use this when you need to set up a persistent assistant that can be used across multiple conversations. The assistant will retain its configuration and can be equipped with tools like code interpreter, file search, or custom functions. Perfect for creating specialized assistants for customer support, coding help, content creation, or domain-specific tasks. Returns the assistant ID for future operations.",
  "category": "assistant",
  "inputSchema": {
    "type": "object",
    "properties": {
      "model": {
        "type": "string",
        "description": "The AI model to use for the assistant (e.g., \"gpt-4\", \"gpt-3.5-turbo\", \"claude-3-sonnet\"). Choose based on your provider's available models and performance requirements."
      },
      "name": {
        "type": "string",
        "description": "A descriptive name for the assistant (e.g., \"Customer Support Bot\", \"Code Review Assistant\", \"Content Writer\"). This helps identify the assistant's purpose."
      },
      "description": {
        "type": "string",
        "description": "A brief description of what the assistant does and its intended use case (e.g., \"Helps customers with product questions and troubleshooting\")."
      },
      "instructions": {
        "type": "string",
        "description": "System instructions that define the assistant's behavior, personality, and capabilities. Be specific about the assistant's role, tone, and how it should respond to users."
      },
      "tools": {
        "type": "array",
        "description": "Array of tools to enable for the assistant. Available tools: code_interpreter (for running Python code), file_search (for searching uploaded files), function (for custom API calls).",
        "items": {
          "type": "object",
          "properties": {
            "type": {
              "type": "string",
              "enum": ["code_interpreter", "file_search", "function"]
            }
          }
        }
      },
      "metadata": {
        "type": "object",
        "description": "Custom key-value pairs for storing additional information about the assistant (e.g., {\"department\": \"support\", \"version\": \"1.0\", \"created_by\": \"admin\"})."
      }
    },
    "required": ["model"]
  },
  "examples": [
    {
      "title": "Create a customer support assistant",
      "description": "Creates an assistant specialized for customer support with helpful personality",
      "input": {
        "model": "gpt-4",
        "name": "Customer Support Assistant",
        "description": "Helps customers with product questions and troubleshooting",
        "instructions": "You are a helpful customer support assistant. Be friendly, patient, and thorough in your responses. Always ask clarifying questions when needed.",
        "metadata": {
          "department": "support",
          "version": "1.0"
        }
      }
    }
  ],
  "metadata": {
    "version": "1.0.0",
    "author": "Jezweb MCP Core Team",
    "lastModified": "2025-01-31T02:21:00.000Z",
    "tags": ["assistant", "create", "management"]
  }
}