{
  "$schema": "../../schemas/tool-schema.json",
  "name": "run-cancel",
  "title": "Cancel Run",
  "description": "Cancel a running assistant execution that is currently in progress. Use this to stop long-running operations, abort stuck runs, or cancel runs that are no longer needed. The run will be stopped and marked as cancelled.",
  "category": "run",
  "inputSchema": {
    "type": "object",
    "properties": {
      "thread_id": {
        "type": "string",
        "description": "The unique identifier of the thread containing the run (format: \"thread_abc123...\")."
      },
      "run_id": {
        "type": "string",
        "description": "The unique identifier of the run to cancel (format: \"run_abc123...\"). Only runs in 'in_progress' or 'requires_action' status can be cancelled."
      }
    },
    "required": ["thread_id", "run_id"]
  },
  "examples": [
    {
      "title": "Cancel stuck run",
      "description": "Stop a run that is taking too long or appears to be stuck",
      "input": {
        "thread_id": "thread_abc123def456ghi789jkl012",
        "run_id": "run_abc123def456ghi789jkl012"
      }
    }
  ],
  "metadata": {
    "version": "1.0.0",
    "author": "Jezweb MCP Core Team",
    "lastModified": "2025-01-31T02:40:00.000Z",
    "tags": ["run", "cancel", "control", "management"]
  }
}