{
  "$schema": "../../schemas/tool-schema.json",
  "name": "run-step-get",
  "title": "Get Run Step Details",
  "description": "Retrieve detailed information about a specific step in a run execution. Use this to examine what the assistant did during a particular step, debug specific issues, or understand tool calls and message creation in detail.",
  "category": "run-step",
  "hints": {
    "readOnly": true
  },
  "inputSchema": {
    "type": "object",
    "properties": {
      "thread_id": {
        "type": "string",
        "description": "The unique identifier of the thread containing the run (format: \"thread_abc123...\")."
      },
      "run_id": {
        "type": "string",
        "description": "The unique identifier of the run containing the step (format: \"run_abc123...\")."
      },
      "step_id": {
        "type": "string",
        "description": "The unique identifier of the step to retrieve (format: \"step_abc123...\")."
      }
    },
    "required": ["thread_id", "run_id", "step_id"]
  },
  "examples": [
    {
      "title": "Examine specific step",
      "description": "Get detailed information about what happened in a particular run step",
      "input": {
        "thread_id": "thread_abc123def456ghi789jkl012",
        "run_id": "run_abc123def456ghi789jkl012",
        "step_id": "step_abc123def456ghi789jkl012"
      }
    }
  ],
  "metadata": {
    "version": "1.0.0",
    "author": "OpenAI Assistants MCP Team",
    "lastModified": "2025-01-31T02:41:00.000Z",
    "tags": ["run-step", "get", "details", "debugging"]
  }
}