{
  "$schema": "../../schemas/tool-schema.json",
  "name": "run-submit-tool-outputs",
  "title": "Submit Tool Outputs",
  "description": "Submit tool call results to continue a run that is waiting for tool outputs. Use this when a run status is 'requires_action' and the assistant has made tool calls that need responses. Essential for interactive workflows where assistants use tools and need results to continue processing.",
  "category": "run",
  "inputSchema": {
    "type": "object",
    "properties": {
      "thread_id": {
        "type": "string",
        "description": "The unique identifier of the thread containing the run (format: \"thread_abc123...\")."
      },
      "run_id": {
        "type": "string",
        "description": "The unique identifier of the run to submit tool outputs for (format: \"run_abc123...\"). Must be in 'requires_action' status."
      },
      "tool_outputs": {
        "type": "array",
        "description": "Array of tool outputs to submit. Each output should correspond to a tool call made by the assistant.",
        "items": {
          "type": "object",
          "properties": {
            "tool_call_id": {
              "type": "string",
              "description": "The ID of the tool call this output is for."
            },
            "output": {
              "type": "string",
              "description": "The output/result of the tool call."
            }
          },
          "required": ["tool_call_id", "output"]
        }
      }
    },
    "required": ["thread_id", "run_id", "tool_outputs"]
  },
  "examples": [
    {
      "title": "Submit function call results",
      "description": "Provide results for tool calls made by the assistant",
      "input": {
        "thread_id": "thread_abc123def456ghi789jkl012",
        "run_id": "run_abc123def456ghi789jkl012",
        "tool_outputs": [
          {
            "tool_call_id": "call_abc123",
            "output": "The weather in San Francisco is 72Â°F and sunny."
          }
        ]
      }
    }
  ],
  "metadata": {
    "version": "1.0.0",
    "author": "OpenAI Assistants MCP Team",
    "lastModified": "2025-01-31T02:40:00.000Z",
    "tags": ["run", "tool-outputs", "interaction", "workflow"]
  }
}