{
  "$schema": "../../schemas/tool-schema.json",
  "name": "assistant-update",
  "title": "Update Assistant",
  "description": "Modify an existing AI assistant's configuration, instructions, tools, or metadata. Use this to refine assistant behavior, add new capabilities, update instructions based on feedback, or change the model. Perfect for iterative improvement and maintaining assistants over time.",
  "category": "assistant",
  "inputSchema": {
    "type": "object",
    "properties": {
      "assistant_id": {
        "type": "string",
        "description": "The unique identifier of the assistant to update (format: \"asst_abc123...\")."
      },
      "model": {
        "type": "string",
        "description": "The AI model to use for the assistant (e.g., \"gpt-4\", \"gpt-3.5-turbo\", \"claude-3-sonnet\"). Choose based on your provider's available models. Leave unchanged if not specified."
      },
      "name": {
        "type": "string",
        "description": "New name for the assistant. Leave unchanged if not specified."
      },
      "description": {
        "type": "string",
        "description": "New description of what the assistant does. Leave unchanged if not specified."
      },
      "instructions": {
        "type": "string",
        "description": "New system instructions that define the assistant's behavior. Leave unchanged if not specified."
      },
      "tools": {
        "type": "array",
        "description": "New array of tools to enable for the assistant. Replaces existing tools if specified.",
        "items": {
          "type": "object",
          "properties": {
            "type": {
              "type": "string",
              "enum": ["code_interpreter", "file_search", "function"]
            }
          }
        }
      },
      "metadata": {
        "type": "object",
        "description": "New metadata key-value pairs. Replaces existing metadata if specified."
      }
    },
    "required": ["assistant_id"]
  },
  "examples": [
    {
      "title": "Update assistant instructions",
      "description": "Refine an assistant's behavior by updating its instructions",
      "input": {
        "assistant_id": "asst_abc123def456ghi789jkl012",
        "instructions": "You are an expert code reviewer with a focus on security and performance. Always check for potential vulnerabilities and suggest optimizations."
      }
    },
    {
      "title": "Add tools to assistant",
      "description": "Enable additional tools for an existing assistant",
      "input": {
        "assistant_id": "asst_abc123def456ghi789jkl012",
        "tools": [
          {"type": "code_interpreter"},
          {"type": "file_search"}
        ]
      }
    }
  ],
  "metadata": {
    "version": "1.0.0",
    "author": "Jezweb MCP Core Team",
    "lastModified": "2025-01-31T02:36:00.000Z",
    "tags": ["assistant", "update", "modify", "management"]
  }
}