{
  "$schema": "../../schemas/tool-schema.json",
  "name": "assistant-delete",
  "title": "Delete Assistant",
  "description": "Permanently delete an AI assistant and all its associated data. Use this for cleanup, removing unused assistants, or when an assistant is no longer needed. This action cannot be undone, so use with caution. All threads using this assistant will no longer be able to create new runs.",
  "category": "assistant",
  "hints": {
    "destructive": true
  },
  "inputSchema": {
    "type": "object",
    "properties": {
      "assistant_id": {
        "type": "string",
        "description": "The unique identifier of the assistant to delete (format: \"asst_abc123...\"). Double-check this ID as deletion is irreversible."
      }
    },
    "required": ["assistant_id"]
  },
  "examples": [
    {
      "title": "Delete an unused assistant",
      "description": "Permanently remove an assistant that is no longer needed",
      "input": {
        "assistant_id": "asst_abc123def456ghi789jkl012"
      }
    }
  ],
  "metadata": {
    "version": "1.0.0",
    "author": "OpenAI Assistants MCP Team",
    "lastModified": "2025-01-31T02:36:00.000Z",
    "tags": ["assistant", "delete", "cleanup", "management"]
  }
}