{
  "$schema": "../../schemas/tool-schema.json",
  "name": "message-get",
  "title": "Get Message Details",
  "description": "Retrieve detailed information about a specific message including its content, metadata, and creation details. Use this to inspect individual messages, verify content, or get message details for debugging purposes.",
  "category": "message",
  "hints": {
    "readOnly": true
  },
  "inputSchema": {
    "type": "object",
    "properties": {
      "thread_id": {
        "type": "string",
        "description": "The unique identifier of the thread containing the message (format: \"thread_abc123...\")."
      },
      "message_id": {
        "type": "string",
        "description": "The unique identifier of the message to retrieve (format: \"msg_abc123...\")."
      }
    },
    "required": ["thread_id", "message_id"]
  },
  "examples": [
    {
      "title": "Get specific message",
      "description": "Retrieve details about a particular message in a conversation",
      "input": {
        "thread_id": "thread_abc123def456ghi789jkl012",
        "message_id": "msg_abc123def456ghi789jkl012"
      }
    }
  ],
  "metadata": {
    "version": "1.0.0",
    "author": "OpenAI Assistants MCP Team",
    "lastModified": "2025-01-31T02:38:00.000Z",
    "tags": ["message", "get", "details", "conversation"]
  }
}