{
  "$schema": "../../schemas/tool-schema.json",
  "name": "thread-update",
  "title": "Update Thread",
  "description": "Modify an existing conversation thread's metadata and properties. Use this to update thread categorization, add tracking information, change priority levels, or organize conversations better. Perfect for maintaining thread organization and adding context as conversations evolve.",
  "category": "thread",
  "inputSchema": {
    "type": "object",
    "properties": {
      "thread_id": {
        "type": "string",
        "description": "The unique identifier of the thread to update (format: \"thread_abc123...\")."
      },
      "metadata": {
        "type": "object",
        "description": "New metadata key-value pairs to replace existing metadata. Use for organizing threads (e.g., {\"priority\": \"high\", \"department\": \"support\", \"status\": \"resolved\"})."
      }
    },
    "required": ["thread_id"]
  },
  "examples": [
    {
      "title": "Update thread priority",
      "description": "Change a thread's priority and add status information",
      "input": {
        "thread_id": "thread_abc123def456ghi789jkl012",
        "metadata": {
          "priority": "high",
          "status": "urgent",
          "department": "engineering",
          "last_updated": "2025-01-31T02:36:00.000Z"
        }
      }
    },
    {
      "title": "Mark thread as resolved",
      "description": "Update thread metadata to indicate resolution",
      "input": {
        "thread_id": "thread_abc123def456ghi789jkl012",
        "metadata": {
          "status": "resolved",
          "resolution_date": "2025-01-31T02:36:00.000Z",
          "resolved_by": "assistant"
        }
      }
    }
  ],
  "metadata": {
    "version": "1.0.0",
    "author": "OpenAI Assistants MCP Team",
    "lastModified": "2025-01-31T02:36:00.000Z",
    "tags": ["thread", "update", "metadata", "organization"]
  }
}