{
  "$schema": "../../schemas/tool-schema.json",
  "name": "run-list",
  "title": "List Thread Runs",
  "description": "Retrieve all runs for a conversation thread with pagination support. Use this to view run history, monitor assistant activity, or debug conversation flows. Essential for understanding how assistants have processed messages over time.",
  "category": "run",
  "hints": {
    "readOnly": true
  },
  "inputSchema": {
    "type": "object",
    "properties": {
      "thread_id": {
        "type": "string",
        "description": "The unique identifier of the thread to list runs from (format: \"thread_abc123...\")."
      },
      "limit": {
        "type": "number",
        "description": "Maximum number of runs to return in one request (1-100, default: 20)."
      },
      "order": {
        "type": "string",
        "enum": ["asc", "desc"],
        "description": "Sort order by creation date: \"desc\" for newest first (default), \"asc\" for oldest first."
      },
      "after": {
        "type": "string",
        "description": "Pagination cursor - run ID to start listing after (format: \"run_abc123...\")."
      },
      "before": {
        "type": "string",
        "description": "Pagination cursor - run ID to end listing before (format: \"run_abc123...\")."
      }
    },
    "required": ["thread_id"]
  },
  "examples": [
    {
      "title": "Get recent runs",
      "description": "Retrieve the latest runs for a thread",
      "input": {
        "thread_id": "thread_abc123def456ghi789jkl012",
        "limit": 10,
        "order": "desc"
      }
    }
  ],
  "metadata": {
    "version": "1.0.0",
    "author": "Jezweb MCP Core Team",
    "lastModified": "2025-01-31T02:39:00.000Z",
    "tags": ["run", "list", "history", "monitoring"]
  }
}