{
  "$schema": "../../schemas/tool-schema.json",
  "name": "run-create",
  "title": "Create Assistant Run",
  "description": "Start a new assistant run on a conversation thread to generate responses. This is the core operation that makes assistants process messages and generate replies. Use this after adding messages to a thread to get assistant responses. The run will process all messages in the thread and generate appropriate responses.",
  "category": "run",
  "inputSchema": {
    "type": "object",
    "properties": {
      "thread_id": {
        "type": "string",
        "description": "The unique identifier of the thread to run the assistant on (format: \"thread_abc123...\")."
      },
      "assistant_id": {
        "type": "string",
        "description": "The unique identifier of the assistant to use for the run (format: \"asst_abc123...\")."
      },
      "model": {
        "type": "string",
        "description": "Override the model used by the assistant for this run (e.g., \"gpt-4\", \"gpt-3.5-turbo\"). Leave empty to use assistant's default model."
      },
      "instructions": {
        "type": "string",
        "description": "Override the instructions of the assistant for this run. Use to provide run-specific context or modify behavior."
      },
      "additional_instructions": {
        "type": "string",
        "description": "Additional instructions to append to the assistant's existing instructions for this run."
      },
      "tools": {
        "type": "array",
        "description": "Override the tools used by the assistant for this run. Replaces assistant's tools if specified.",
        "items": {
          "type": "object",
          "properties": {
            "type": {
              "type": "string",
              "enum": ["code_interpreter", "file_search", "function"]
            }
          }
        }
      },
      "metadata": {
        "type": "object",
        "description": "Custom metadata for the run (e.g., {\"priority\": \"high\", \"source\": \"api\", \"user_id\": \"12345\"})."
      }
    },
    "required": ["thread_id", "assistant_id"]
  },
  "examples": [
    {
      "title": "Start basic assistant run",
      "description": "Run an assistant on a thread to generate responses",
      "input": {
        "thread_id": "thread_abc123def456ghi789jkl012",
        "assistant_id": "asst_abc123def456ghi789jkl012"
      }
    },
    {
      "title": "Run with custom instructions",
      "description": "Override assistant instructions for a specific run",
      "input": {
        "thread_id": "thread_abc123def456ghi789jkl012",
        "assistant_id": "asst_abc123def456ghi789jkl012",
        "additional_instructions": "Please provide a detailed explanation with code examples."
      }
    }
  ],
  "metadata": {
    "version": "1.0.0",
    "author": "OpenAI Assistants MCP Team",
    "lastModified": "2025-01-31T02:38:00.000Z",
    "tags": ["run", "create", "assistant", "execution"]
  }
}